{"schema_version":"1.0","state_id":"US-NJ","scope":{"code_families":["building","fire_operational"],"start_date":"2020-01-01","end_date":"2026-08-02"},"primary_source_ids":["src:us-nj:ucc","src:us-nj:current-codes","src:us-nj:previous-codes","src:us-nj:codes-about","src:us-nj:local-enforcement","src:us-nj:bcpr","src:us-nj:fire-safety","src:us-nj:fire-codes","src:us-nj:ifc-2018","src:us-nj:trenton-tech","src:us-nj:trenton-ch42","src:us-nj:trenton-ch97"],"required_fixture_kinds":["conflict","historical","incorporated","missing_evidence","special_project","unincorporated"],"timelines":[{"code_family":"building","start_date":"2020-01-01","end_date":"2020-03-02","adoption_ids":["adoption:us-nj:building:2015","adoption:us-nj:building:2018"],"source_ids":["src:us-nj:previous-codes"],"verification":{"status":"verified","confidence":0.95}},{"code_family":"building","start_date":"2020-03-03","end_date":"2022-09-05","adoption_ids":["adoption:us-nj:building:2018"],"source_ids":["src:us-nj:previous-codes"],"verification":{"status":"verified","confidence":0.95}},{"code_family":"building","start_date":"2022-09-06","end_date":"2023-03-05","adoption_ids":["adoption:us-nj:building:2018","adoption:us-nj:building:2021"],"source_ids":["src:us-nj:current-codes","src:us-nj:previous-codes"],"verification":{"status":"verified","confidence":0.95}},{"code_family":"building","start_date":"2023-03-06","end_date":null,"adoption_ids":["adoption:us-nj:building:2021"],"source_ids":["src:us-nj:current-codes","src:us-nj:previous-codes"],"verification":{"status":"verified","confidence":0.95}},{"code_family":"fire_operational","start_date":"2020-01-01","end_date":"2024-10-14","adoption_ids":["adoption:us-nj:fire:2015"],"source_ids":["src:us-nj:fire-codes"],"verification":{"status":"verified","confidence":0.95}},{"code_family":"fire_operational","start_date":"2024-10-15","end_date":null,"adoption_ids":["adoption:us-nj:fire:2018"],"source_ids":["src:us-nj:fire-codes","src:us-nj:ifc-2018"],"verification":{"status":"verified","confidence":0.95}}],"fixtures":[{"id":"fixture:us-nj:trenton-building","kind":"incorporated","jurisdiction":"City of Trenton","code_families":["building"],"applicability_date":"2026-08-02","expected_status":"partially_resolved","production_supported":true,"source_ids":["src:us-nj:ucc","src:us-nj:current-codes","src:us-nj:codes-about","src:us-nj:local-enforcement","src:us-nj:trenton-tech","src:us-nj:trenton-ch42"],"local_source_ids":["src:us-nj:trenton-tech","src:us-nj:trenton-ch42"],"verification":{"status":"verified","confidence":0.95,"notes":"The current statewide UCC building subcode and Trenton plan-review, permit, inspection, and enforcement office are identified."}},{"id":"fixture:us-nj:trenton-fire","kind":"incorporated","jurisdiction":"City of Trenton","code_families":["fire_operational"],"applicability_date":"2026-08-02","expected_status":"partially_resolved","production_supported":true,"source_ids":["src:us-nj:fire-safety","src:us-nj:fire-codes","src:us-nj:ifc-2018","src:us-nj:trenton-tech","src:us-nj:trenton-ch97"],"local_source_ids":["src:us-nj:trenton-tech","src:us-nj:trenton-ch97"],"verification":{"status":"verified","confidence":0.95,"notes":"The 2018 IFC New Jersey Edition and Trenton local enforcing agency, inspections, appeals, and local provisions are identified."}},{"id":"fixture:us-nj:state-owned-building","kind":"special_project","jurisdiction":"New Jersey state-owned building","code_families":["building"],"applicability_date":"2026-08-02","expected_status":"resolved","production_supported":true,"source_ids":["src:us-nj:ucc","src:us-nj:current-codes","src:us-nj:bcpr"],"local_source_ids":[],"verification":{"status":"verified","confidence":0.95,"notes":"The Bureau of Construction Project Review is identified as the state plan-review and release authority for the represented project class."}},{"id":"fixture:us-nj:trenton-building-historical","kind":"historical","jurisdiction":"City of Trenton","code_families":["building"],"applicability_date":"2021-01-01","expected_status":"partially_resolved","production_supported":true,"source_ids":["src:us-nj:previous-codes","src:us-nj:trenton-ch42"],"local_source_ids":["src:us-nj:trenton-ch42"],"verification":{"status":"verified","confidence":0.9,"notes":"The 2018 IBC-based UCC window and Trenton's established enforcing-agency ordinance support the historical determination."}},{"id":"fixture:us-nj:unincorporated-review","kind":"unincorporated","jurisdiction":"New Jersey geometry without a municipality match","code_families":["building"],"applicability_date":"2026-08-02","expected_status":"insufficient_evidence","production_supported":false,"source_ids":["src:us-nj:ucc","src:us-nj:local-enforcement"],"local_source_ids":[],"verification":{"status":"verified","confidence":0.95,"notes":"New Jersey locations ordinarily resolve to a municipality; an unmatched result deliberately fails closed pending regional or state enforcement confirmation."}},{"id":"fixture:us-nj:missing-local-record","kind":"missing_evidence","jurisdiction":"New Jersey property without a matched enforcing-agency record","code_families":["building"],"applicability_date":"2026-08-02","expected_status":"insufficient_evidence","production_supported":false,"source_ids":["src:us-nj:ucc","src:us-nj:current-codes","src:us-nj:local-enforcement"],"local_source_ids":[],"verification":{"status":"verified","confidence":0.95,"notes":"The fixture verifies that a statewide UCC edition does not invent the responsible permit and inspection office."}},{"id":"fixture:us-nj:conflicting-edition-claim","kind":"conflict","jurisdiction":"New Jersey synthetic transition conflict","code_families":["building"],"applicability_date":"2022-10-01","expected_status":"conflicting","production_supported":false,"source_ids":["src:us-nj:current-codes","src:us-nj:previous-codes"],"local_source_ids":[],"verification":{"status":"verified","confidence":0.95,"notes":"The negative fixture injects incompatible edition-selection claims during the documented six-month transition and requires explicit conflict preservation."}}]}
