{"schema_version":"1.0","state_id":"US-CO","scope":{"code_families":["electrical"],"start_date":"2020-07-01","end_date":"2026-08-02"},"primary_source_ids":["src:us-co:electrical-board","src:us-co:electrical-2020-news","src:us-co:larimer-adoption-history","src:us-co:larimer-codes","src:us-co:larimer-building","src:us-co:larimer-electrical-permits","src:us-co:denver-permits","src:us-co:denver-quick-permits"],"required_fixture_kinds":["conflict","historical","incorporated","missing_evidence","special_project","unincorporated"],"timelines":[{"code_family":"electrical","start_date":"2020-07-01","end_date":"2023-07-31","adoption_ids":["adoption:us-co:electrical:2020-nec"],"source_ids":["src:us-co:electrical-2020-news","src:us-co:larimer-adoption-history"],"verification":{"status":"verified","confidence":0.95}},{"code_family":"electrical","start_date":"2023-08-01","end_date":"2026-07-31","adoption_ids":["adoption:us-co:electrical:2023-nec"],"source_ids":["src:us-co:larimer-codes"],"verification":{"status":"verified","confidence":0.95}},{"code_family":"electrical","start_date":"2026-08-01","end_date":null,"adoption_ids":["adoption:us-co:electrical:2026-nec"],"source_ids":["src:us-co:larimer-building"],"verification":{"status":"verified","confidence":0.95}}],"fixtures":[{"id":"fixture:us-co:denver-electrical-current","kind":"incorporated","jurisdiction":"City and County of Denver","code_families":["electrical"],"applicability_date":"2026-08-02","expected_status":"partially_resolved","production_supported":true,"source_ids":["src:us-co:electrical-board","src:us-co:larimer-building","src:us-co:denver-permits","src:us-co:denver-quick-permits"],"local_source_ids":["src:us-co:denver-permits","src:us-co:denver-quick-permits"],"verification":{"status":"verified","confidence":0.95,"notes":"The statewide 2026 NEC window and Denver electrical permit, plan-review, and inspection path are identified."}},{"id":"fixture:us-co:larimer-electrical-current","kind":"unincorporated","jurisdiction":"Unincorporated Larimer County","code_families":["electrical"],"applicability_date":"2026-08-02","expected_status":"partially_resolved","production_supported":true,"source_ids":["src:us-co:electrical-board","src:us-co:larimer-building","src:us-co:larimer-electrical-permits"],"local_source_ids":["src:us-co:larimer-building","src:us-co:larimer-electrical-permits"],"verification":{"status":"verified","confidence":0.95,"notes":"The statewide 2026 NEC window and Larimer County permit, plan-review, inspection, and enforcement path are identified."}},{"id":"fixture:us-co:state-public-school-electrical","kind":"special_project","jurisdiction":"Colorado public school or state building","code_families":["electrical"],"applicability_date":"2026-08-02","expected_status":"partially_resolved","production_supported":true,"source_ids":["src:us-co:electrical-board","src:us-co:larimer-building"],"local_source_ids":[],"verification":{"status":"verified","confidence":0.95,"notes":"The State Electrical Board issues permits and performs electrical inspections for public schools and state buildings statewide."}},{"id":"fixture:us-co:larimer-electrical-historical","kind":"historical","jurisdiction":"Unincorporated Larimer County","code_families":["electrical"],"applicability_date":"2022-01-01","expected_status":"partially_resolved","production_supported":true,"source_ids":["src:us-co:electrical-2020-news","src:us-co:larimer-adoption-history","src:us-co:larimer-electrical-permits"],"local_source_ids":["src:us-co:larimer-adoption-history","src:us-co:larimer-electrical-permits"],"verification":{"status":"verified","confidence":0.95,"notes":"The 2020 NEC window and Larimer County's July 1, 2020 local inspection handoff support a date-aware historical result."}},{"id":"fixture:us-co:missing-local-electrical-record","kind":"missing_evidence","jurisdiction":"Colorado location without a matched local inspection record","code_families":["electrical"],"applicability_date":"2026-08-02","expected_status":"insufficient_evidence","production_supported":false,"source_ids":["src:us-co:electrical-board","src:us-co:larimer-building"],"local_source_ids":[],"verification":{"status":"verified","confidence":0.95,"notes":"The fixture verifies that the statewide NEC edition does not invent whether state or local inspection applies."}},{"id":"fixture:us-co:conflicting-nec-edition","kind":"conflict","jurisdiction":"Colorado synthetic NEC transition conflict","code_families":["electrical"],"applicability_date":"2026-08-01","expected_status":"conflicting","production_supported":false,"source_ids":["src:us-co:larimer-codes","src:us-co:larimer-building"],"local_source_ids":[],"verification":{"status":"verified","confidence":0.95,"notes":"The negative fixture injects incompatible current-edition claims at the documented 2026 transition and requires explicit conflict preservation."}}]}
